{
  "id": "person-diana-princess-of-wales",
  "slug": "diana-princess-of-wales",
  "name": "Diana, Princess of Wales",
  "description": "Diana Frances Spencer (1 July 1961 – 31 August 1997), known as Diana, Princess of Wales, was a member of the British royal family and a prominent humanitarian.",
  "sources": [
    {
      "kind": "biography",
      "url": "https://www.britannica.com/biography/Diana-princess-of-Wales"
    }
  ]
}
